{
  "contractVersion": "1.0",
  "assetId": "1e2f3a4b-5c6d-4e7f-8a9b-0c1d2e3f4a5b",
  "outcome": "DUPLICATE",
  "receivedHash": "3f4ececbf6ee049d9107995d0c333cadc98c1906335faa4ae635ec82820809ea",
  "duplicateOf": "1e2f3a4b-5c6d-4e7f-8a9b-0c1d2e3f4a5b",
  "note": "Logical upload already received under the same idempotency key; no second asset created."
}
